{"advancements":[{"announceToChat":true,"background":null,"description":{"text":"Besiege einen Gegner"},"frame":"goal","hidden":false,"icon":"minecraft:iron_sword","id":"6b662b93-1b3a-58b9-ac9e-f6c3930b40d7","key":"cygnus:first_kill","parent":"cygnus:root","previousKeys":[],"showToast":true,"title":{"text":"Erster Kill"},"x":1.0,"y":0.0},{"announceToChat":false,"background":"cygnus:textures/gui/advancements/backgrounds/cygnus.png","description":{"text":"Betritt Cygnus"},"frame":"task","hidden":false,"icon":"minecraft:compass","id":"43de1c8a-e912-520a-985d-60ec86891515","key":"cygnus:root","parent":null,"previousKeys":[],"showToast":false,"title":{"text":"Cygnus"},"x":0.0,"y":0.0}],"assets":[{"kind":"sound","path":"assets/cygnus/sounds/ui/click.ogg","resolution":null,"sha1":"9a8b7c6d5e4f30211203f4e5d6c7b8a9f0e1d2c3","size":4096},{"kind":"texture","path":"assets/cygnus/textures/font/hud_icons.png","resolution":16,"sha1":"2f1e0c6a9b3d4e5f60718293a4b5c6d7e8f90a1b","size":512}],"attributes":[{"defaultValue":0.0,"displayName":"Krit-Chance","id":"ff4741e6-d71f-5ef3-9fc3-d24e4d136193","key":"cygnus:crit_chance","maximumValue":1.0,"minimumValue":0.0,"previousKeys":[],"synced":true,"translationKey":null},{"defaultValue":1.0,"displayName":"Stärke","id":"b63c2cd1-52ea-57dd-a095-d38a4fa402aa","key":"cygnus:strength","maximumValue":20.0,"minimumValue":0.0,"previousKeys":[],"synced":false,"translationKey":"attribute.cygnus.strength"}],"expressionFunctions":[{"description":"Schaden nach Rüstung","expression":"base * (1 - armor / 100)","id":"c91dab27-e52f-5b83-aa81-cb2b3d8a971e","kind":"formula","name":"armorDamage","parameters":[{"name":"base","type":"number"},{"name":"armor","type":"number"}],"previousNames":[],"returnType":"number"},{"description":"Ob der Spieler in einer Arena steht","expression":null,"id":"709b4d25-2545-5bde-a8bf-06d9fef28803","kind":"interface","name":"inArena","parameters":[{"name":"arena","type":"string"}],"previousNames":[],"returnType":"boolean"}],"expressions":[{"description":"Maximale Lebenspunkte nach Stufe","expression":"20 + level * armorDamage(2, 0)","id":"0f4b8c2e-6d1a-5e7b-a3c9-41d2e8f07b65","name":"maxHealth","previousNames":["oldHealth"],"returnType":"number","variables":[{"name":"level","type":"number"}]}],"fonts":[{"ascent":7,"chars":[""],"file":"cygnus:font/hud_icons.png","font":"cygnus:hud","height":8,"id":"f49a3303-350b-5a6a-9494-03b290764a25","key":"cygnus:hud_icons","previousKeys":[],"type":"bitmap"}],"format":1,"items":[{"amount":1,"components":{"minecraft:enchantments":{"minecraft:sharpness":5},"minecraft:lore":[{"text":"Zeile 1"}]},"id":"12f6f240-843f-5833-8fba-a8ffbe31c173","key":"cygnus:iron_sword","material":"minecraft:iron_sword","previousKeys":["cygnus:old_sword"]},{"amount":16,"components":{"minecraft:food":{"nutrition":4,"saturation":2.4}},"id":"d2875ef7-ea80-56af-9955-1c8a4be7938d","key":"cygnus:ration","material":"minecraft:bread","previousKeys":[]}],"namespace":"cygnus","pack":{"description":{"text":"Cygnus"},"resolutions":[16,32]},"projectId":"5b0c7a52-3c1e-4d7a-9f2e-0a1b2c3d4e5f","sounds":[{"id":"3b791b12-7153-5533-a127-62018a7fa823","key":"cygnus:ui.click","previousKeys":[],"replace":false,"sounds":[{"attenuationDistance":16,"name":"cygnus:ui/click","pitch":1.0,"preload":false,"stream":false,"type":"file","volume":0.5,"weight":1}],"subtitle":"Klick"}]}
